[
{"slug":"explain-error-message-fix","category":"code","sub":"debug","title":"توضیح و رفع پیام خطا","fa":"این خطا را دریافت می‌کنم: [پیام خطا]. کد مربوطه: [کد]. زبان/فریم‌ورک: [زبان]. اول در ۲ جمله بگو این خطا دقیقاً یعنی چه، بعد ۳ علت احتمالی را به ترتیب احتمال فهرست کن، سپس کد اصلاح‌شده را بده و توضیح بده چه تغییری کردی. اگر اطلاعات کافی نیست، بگو چه چیزی لازم است.","en":"I get this error: [error message]. Related code: [code]. Language/framework: [language]. First explain in two sentences what the error means, then list three likely causes in order of probability, then give the fixed code and explain the change. If information is missing, say what you need.","summary":"تشخیص سریع معنای خطا و راه‌حل عملی با کد اصلاح‌شده.","tools":["claude","chatgpt","cursor","copilot"],"tags":["دیباگ","خطا","رفع باگ","کد"]},
{"slug":"code-review-senior-checklist","category":"code","sub":"review","title":"بازبینی کد مثل یک سینیور","fa":"تو یک توسعه‌دهنده‌ی سینیور [زبان] هستی. این کد را بازبینی کن: [کد]. خروجی در چهار بخش: باگ‌های قطعی، مشکلات امنیتی یا کارایی، خوانایی و نام‌گذاری، و پیشنهادهای اختیاری. هر مورد با شماره‌ی خط و راه‌حل کوتاه. اول موارد مهم، و اگر کد خوب است صریح بگو.","en":"You are a senior [language] developer. Review this code: [code]. Output in four sections: definite bugs, security or performance issues, readability and naming, and optional suggestions. Each item with line number and a brief fix. Critical items first, and if the code is fine, say so plainly.","summary":"بازخورد ساختاریافته‌ی کد پیش از ارسال پول‌ریکوئست.","tools":["claude","chatgpt","cursor","copilot"],"tags":["بازبینی کد","کیفیت","پول‌ریکوئست","تیم"]},
{"slug":"write-unit-tests-edge-cases","category":"code","sub":"test","title":"نوشتن تست یونیت","fa":"برای این تابع با فریم‌ورک [Jest/PHPUnit/pytest] تست یونیت بنویس: [کد]. حداقل ۶ تست: مسیر عادی، مقادیر مرزی، ورودی خالی یا null، ورودی نامعتبر و یک مورد همزمانی یا خطای خارجی اگر مربوط است. نام هر تست رفتار را توصیف کند. وابستگی‌ها را mock کن و فقط کد تست را بده.","en":"Write unit tests for this function using [Jest/PHPUnit/pytest]: [code]. At least 6 tests: happy path, boundary values, empty or null input, invalid input, and one concurrency or external-failure case if relevant. Name each test after the behavior it checks. Mock dependencies and output only the test code.","summary":"پوشش تست کامل برای یک تابع، شامل حالت‌های مرزی که معمولاً فراموش می‌شوند.","tools":["claude","chatgpt","cursor","copilot"],"tags":["تست","یونیت تست","کیفیت","TDD"]},
{"slug":"refactor-for-readability","category":"code","sub":"refactor","title":"بازنویسی برای خوانایی","fa":"این کد را بازنویسی (refactor) کن تا خواناتر شود، بدون تغییر رفتار: [کد]. اصول: توابع کوچک با یک وظیفه، نام‌های گویا، حذف تکرار، کاهش تودرتویی با early return، و حذف کامنت‌های غیرضروری. کد نهایی را کامل بده و بعد در ۵ خط بگو هر تغییر چه مشکلی را حل کرد.","en":"Refactor this code for readability without changing its behavior: [code]. Principles: small single-purpose functions, descriptive names, no duplication, less nesting via early returns, and no unnecessary comments. Output the complete final code, then in five lines explain what problem each change solved.","summary":"کد شلوغ را به کدی تمیز و قابل‌نگهداری تبدیل می‌کند.","tools":["claude","cursor","chatgpt","copilot"],"tags":["ریفکتور","کد تمیز","خوانایی","نگهداری"]},
{"slug":"regex-build-and-explain","category":"code","sub":"explain","title":"ساخت رجکس با توضیح","fa":"یک عبارت باقاعده (regex) بساز که [شرح الگو، مثلاً شماره موبایل ایران با یا بدون +98] را تشخیص دهد، برای زبان [JavaScript/PHP/Python]. خروجی: رجکس، توضیح قسمت‌به‌قسمت، ۵ مثال که باید match شود و ۵ مثال که نباید، و یک نکته درباره‌ی حالت‌های لبه‌ای که پوشش نداده.","en":"Build a regular expression that matches [pattern description, e.g. Iranian mobile numbers with or without +98] for [JavaScript/PHP/Python]. Output: the regex, a part-by-part explanation, 5 strings that should match and 5 that should not, and one note on edge cases it does not cover.","summary":"رجکس آماده با توضیح و نمونه‌های تست برای اعتبارسنجی ورودی.","tools":["chatgpt","claude","deepseek","copilot"],"tags":["رجکس","اعتبارسنجی","الگو","متن"]},
{"slug":"sql-query-from-plain-description","category":"code","sub":"sql","title":"کوئری SQL از توضیح فارسی","fa":"با این ساختار جدول‌ها: [اسکیما]، یک کوئری [MySQL/PostgreSQL] بنویس که [خواسته به زبان ساده، مثلاً ۱۰ مشتری با بیشترین خرید در ماه گذشته] را برگرداند. کوئری را با نام‌های مستعار خوانا و توضیح یک‌خطی برای هر JOIN یا شرط بده، و بگو کدام ایندکس آن را سریع‌تر می‌کند.","en":"Given these table structures: [schema], write a [MySQL/PostgreSQL] query that returns [plain-language request, e.g. the 10 customers with the highest spend last month]. Use readable aliases, add a one-line comment per JOIN or condition, and say which index would speed it up.","summary":"تبدیل نیاز گزارشی به کوئری دقیق و بهینه بدون حفظ‌کردن سینتکس.","tools":["chatgpt","claude","deepseek","copilot"],"tags":["SQL","دیتابیس","کوئری","گزارش"]},
{"slug":"sql-optimize-slow-query","category":"code","sub":"sql","title":"بهینه‌سازی کوئری کند","fa":"این کوئری کند است: [کوئری]. ساختار جدول‌ها و ایندکس‌های فعلی: [اسکیما]. حجم تقریبی داده: [تعداد ردیف]. تحلیل کن چرا کند است (full scan، JOIN نامناسب، تابع روی ستون ایندکس‌شده، N+1…)، نسخه‌ی بازنویسی‌شده را بده، ایندکس‌های پیشنهادی را با دستور CREATE INDEX بنویس و بگو چطور با EXPLAIN بسنجم.","en":"This query is slow: [query]. Table structures and current indexes: [schema]. Approximate data size: [row count]. Analyze why it is slow (full scan, bad JOIN, function on an indexed column, N+1...), give a rewritten version, propose indexes as CREATE INDEX statements, and explain how to verify with EXPLAIN.","summary":"تشخیص دلیل کندی کوئری و ارائه‌ی نسخه‌ی سریع‌تر با ایندکس مناسب.","tools":["claude","chatgpt","deepseek"],"tags":["SQL","بهینه‌سازی","ایندکس","کارایی"]},
{"slug":"commit-message-conventional","category":"code","sub":"docs","title":"پیام کامیت استاندارد","fa":"بر اساس این diff یک پیام کامیت به سبک Conventional Commits بنویس: [diff یا شرح تغییرات]. خط اول: type(scope): خلاصه‌ی امری زیر ۵۰ نویسه به انگلیسی. بعد یک خط خالی و بدنه‌ای ۲ تا ۴ خطی که «چرا» را توضیح دهد نه «چه». اگر تغییر شکننده است BREAKING CHANGE اضافه کن. فقط پیام را بده.","en":"Based on this diff, write a Conventional Commits message: [diff or change description]. First line: type(scope): imperative summary under 50 characters. Then a blank line and a 2–4 line body explaining why, not what. Add a BREAKING CHANGE footer if applicable. Output only the message.","summary":"پیام کامیت تمیز و استاندارد که تاریخچه‌ی گیت را قابل‌فهم می‌کند.","tools":["cursor","copilot","claude","chatgpt"],"tags":["گیت","کامیت","تیم","استاندارد"]},
{"slug":"readme-generate-from-code","category":"code","sub":"docs","title":"تولید README از کد","fa":"برای این پروژه یک README.md به [فارسی/انگلیسی] بنویس. فایل اصلی و ساختار: [کد یا فهرست فایل‌ها]. بخش‌ها: معرفی یک‌پاراگرافی، ویژگی‌ها، پیش‌نیازها، نصب گام‌به‌گام با دستورها، مثال استفاده با کد، پیکربندی (متغیرهای محیطی)، و لایسنس. فقط چیزی را بنویس که از کد برمی‌آید.","en":"Write a README.md in [Persian/English] for this project. Main file and structure: [code or file list]. Sections: one-paragraph intro, features, prerequisites, step-by-step install with commands, usage example with code, configuration (environment variables), and license. Only state what the code actually supports.","summary":"مستند ورودی پروژه برای گیت‌هاب یا تحویل به تیم، بدون ادعای اضافه.","tools":["claude","chatgpt","cursor","copilot"],"tags":["README","مستندسازی","گیت‌هاب","اوپن‌سورس"]},
{"slug":"convert-code-between-languages","category":"code","sub":"explain","title":"تبدیل کد بین زبان‌ها","fa":"این کد [زبان مبدأ] را به [زبان مقصد] تبدیل کن: [کد]. از اصطلاحات و کتابخانه‌ی استاندارد زبان مقصد استفاده کن، نه ترجمه‌ی خط‌به‌خط. رفتار، نام‌ها و مدیریت خطا را حفظ کن. بعد از کد، در فهرستی کوتاه بگو کدام قسمت‌ها معادل مستقیم ندارند و چه تصمیمی گرفتی.","en":"Convert this [source language] code to [target language]: [code]. Use the target language's idioms and standard library rather than a line-by-line translation. Preserve behavior, names, and error handling. After the code, briefly list which parts had no direct equivalent and what you decided.","summary":"پورت کردن کد به زبان دیگر با رعایت سبک بومی آن زبان.","tools":["claude","chatgpt","deepseek","cursor"],"tags":["تبدیل کد","مهاجرت","زبان برنامه‌نویسی","پورت"]},
{"slug":"explain-code-to-beginner","category":"code","sub":"explain","title":"توضیح کد برای مبتدی","fa":"این کد را برای کسی که تازه برنامه‌نویسی را شروع کرده توضیح بده: [کد]. اول در یک جمله بگو کد چه می‌کند، بعد خط‌به‌خط یا بلوک‌به‌بلوک با زبان ساده و یک تشبیه روزمره توضیح بده. اصطلاح فنی را اول تعریف کن، بعد استفاده کن. در پایان ۲ سؤال بده که خواننده بتواند فهمش را بسنجد.","en":"Explain this code to someone who just started programming: [code]. First say in one sentence what it does, then walk through it line by line or block by block in plain language with one everyday analogy. Define each technical term before using it. End with two questions the reader can use to check their understanding.","summary":"یادگیری کد ناآشنا یا آموزش به تازه‌کارها با زبان ساده.","tools":["chatgpt","claude","gemini","deepseek"],"tags":["آموزش","مبتدی","توضیح کد","یادگیری"]},